<?xml version="1.0" encoding="UTF-8"?>
<d4:projects xmlns:d4="http://www.issuetracker.training.org/project"
             xmlns:xsi="http://www.w3.org/2001/XMLSchema-instance"
             xsi:schemaLocation="http://www.issuetracker.training.org/project project.xsd ">
	<project id="1">
		<name>Visualisation</name>
		<description>Display of graphic objects according to their description</description>
		<userId>1</userId>
	</project>
	<project id="2">
		<name>SectionModel</name>
		<description>Creation of events and states of objects according to their description</description>
		<userId>1</userId>
	</project>
	<project id="3">
		<name>TSPlayer</name>
		<description>play again from impulses</description>
		<userId>1</userId>
	</project>
	<project id="4">
		<name>IS</name>
		<description>receiving data over various communication channels</description>
		<userId>1</userId>
	</project>
</d4:projects>
